Titulo,Es taller,Puntuacion
Curso de HR Agile: Scrum Project Management,False,0.0
Curso de HR Agile: Kanban Recruitment,False,0.0
Curso de Confluence: Funcionalidades y gestión documental,False,0.0
Curso de Angular en el mundo de la multiplataforma,False,5.0
¿Cómo generar un Web Service con Spring Boot?,True,4.67
Laboratorio de Servicios de Redes y Computación en Azure,False,0.0
Curso de Power Automate,False,4.5
Curso de Machine Learning no supervisado en Python,False,3.5
Curso de Jira: Funcionalidades y gestión de proyectos Agile,False,4.75
Laboratorio de Fundamentos de NestJS,False,0.0
Curso de Seguridad de red en el ámbito corporativo: Capas 3 y 7 del modelo OSI,False,5.0
Curso de Notion para tu gestión y documentación,False,5.0
"Laboratorio Crea una REST API con NestJS, PostgreSQL, MongoDB y Docker",False,0.0
Curso de Gamificación en entornos laborales,False,5.0
Curso de Videojuegos con Python y Pyglet,False,4.33
Curso de Automatizaciones de Selenium para Shadow Root,False,3.0
Curso de Machine Learning supervisado con Scikit-learn,False,4.67
Disciplina positiva: Cultura enfocada en soluciones,True,5.0
Curso de Seguridad de red en el ámbito corporativo: Capa 2 del modelo OSI,False,5.0
Disciplina positiva: Fortalece las relaciones de equipo y aumenta tus ganancias,True,5.0
Introducción a Next.js,True,4.0
Disciplina positiva: Convierte tu empresa en el lugar donde todo el mundo quiere trabajar,True,2.0
"Disciplina positiva: Empleados felices, resultados grandiosos",True,4.75
Disciplina positiva: Cultura de pertenencia y alto rendimiento,True,4.0
Disciplina positiva: Construye un mejor lugar de trabajo,True,4.56
¿Cuál es el mejor IDE para programar en Java?,True,4.25
Curso de Inbound Recruiting: Atrae a tus mejores candidatos,False,0.0
Mediación cómo estrategia de gestión de conflictos laborales,True,4.0
Curso BDD en Go,False,5.0
Aspectos de Scrum para fomentar el Bienestar laboral,True,5.0
Humanizar los procesos de selección para mejorar la experiencia del candidato,True,4.0
Gamificación aplicada: diseña tu propio proyecto,True,0.0
Ingredientes en la metodología Inbound Recruiting,True,0.0
Chief Happiness Officer: ¿Qué le puede ofrecer a tu equipo?,True,0.0
Conoce cómo lograr los hábitos que quieres,True,4.5
Curso TDD en Go,False,5.0
Curso Cisco CCNP Enterprise ENCOR Parte 2: Protocolo Spanning Tree y EtherChannel,False,0.0
Curso Cisco CCNP Enterprise ENCOR Parte 3: Fundamentos de enrutamiento IP,False,0.0
Azure Database para MariaDB,True,4.6
Curso Cisco CCNP Enterprise ENCOR Parte 4: EIGRP,False,0.0
Azure Synapse Analytics,True,4.0
TimeBlocking para tu organización,True,4.4
Azure Database para MySQL,True,4.0
Introducción a Cisco Packet Tracer,True,5.0
Prioriza tareas y no te hundas en la miseria,True,4.36
Curso Certificación Cisco CCNA 200-301 Parte 5: Fundamentos de seguridad,False,5.0
Curso Certificación Cisco CCNA 200-301 Parte 5.1: Prácticas de Fundamentos de seguridad,False,5.0
Curso Certificación Cisco CCNA 200-301 Parte 6: Automatización y programabilidad,False,5.0
Laboratorio Certificación Cisco CCNA 200-301 Parte 7: Simulación de examen,False,5.0
Curso de Administración del Servidor WildFly: Configuración avanzada,False,4.29
MVC con C# Core y Asp.net: Objeto DTO,True,3.8
MVC con C# Core y Asp.net: Backup,True,5.0
Curso de Administración del Servidor WildFly: Instalación y configuración inicial,False,4.5
Curso Cisco CCNP Enterprise ENCOR Parte 1: Fundamentos de redes,False,0.0
Laboratorio de Diseño de APIs,False,4.4
Curso Certificación Cisco CCNA 200-301 Parte 1.1: Prácticas de Fundamentos de redes,False,0.0
Curso Certificación Cisco CCNA 200-301 Parte 2.1: Prácticas de Acceso a la red,False,0.0
Curso Certificación Cisco CCNA 200-301 Parte 1: Fundamentos de redes,False,5.0
Curso Certificación Cisco CCNA 200-301 Parte 2: Acceso a la red,False,0.0
Curso Certificación Cisco CCNA 200-301 Parte 4: Servicios IP,False,0.0
Curso Certificación Cisco CCNA 200-301 Parte 3: Conectividad IP,False,5.0
Curso Certificación Cisco CCNA 200-301 Parte 3.1: Prácticas de Conectividad IP,False,0.0
Curso Certificación Cisco CCNA 200-301 Parte 4.1: Prácticas de Servicios IP,False,0.0
Curso Mi primera DApp,False,4.27
Curso de Smart Contracts y Solidity,False,4.32
Curso de Introducción al Esquema Nacional de Seguridad (ENS),False,4.32
"Laboratorio de Microsoft Project: Crea, optimiza y presenta un proyecto",False,4.0
Crea un JPA repository con Spring Boot y PostgreSQL,True,4.11
MVC con C# Core y Asp.net: Instalación de la plataforma,True,4.5
MVC con C# Core y Asp.net: Patrón MVC,True,4.55
Curso de Ciberseguridad en WordPress,False,4.36
Machine Learning con clasificadores lineales en Python,True,4.75
Laboratorio de Gestión del diseño de APIs y OpenAPI,False,5.0
Machine Learning con modelos basados en árboles en Python,True,5.0
WebAssembly en Go,True,4.86
HR Agile: The New Revolution,True,4.5
Curso de Storytelling y Visualización de datos,False,4.41
Curso de Ethereum desde cero,False,4.15
Herramientas y tecnologías básicas para ser un desarrollador de Blockchain,True,4.8
Representa tus datos de forma adecuada,True,4.73
Mejora visualmente tus informes en Power BI,True,4.57
Laboratorio de Introducción a la administración de sistemas NGINX,False,4.19
Creación de APIs REST en PHP sin frameworks,True,4.8
Curso UX Research: La investigación de usuario al servicio de la creación y optimización del producto digital,False,4.0
Curso de Android Jetpack Architecture,False,4.42
Curso de creación de interfaces de usuario con Jetpack Compose,False,4.44
Introduciendo una Capa de seguridad y contenido multimedia a nuestra API REST en PHP,True,4.67
Curso de Estrategias UX para la innovación de productos,False,3.57
Reducción de dimensionalidad para Machine Learning en Python,True,4.5
Laboratorio de Automatización de pruebas para Web Apps con Katalon Studio,False,4.5
Autenticación Biométrica con Android,True,5.0
Arquitectura Hexagonal con Django,True,5.0
Azure Data Factory,True,4.67
Curso Creación de APIs con FastAPI,False,4.08
Android Sleep API: Trackea cómo sueñas,True,5.0
Evaluación y diagnóstico de la Experiencia de Usuario de un producto digital a través de UX Research,True,3.5
Laboratorio de Instalación avanzada de servidores Linux,False,4.93
Curso de Implantación de una PMO,False,4.0
Obtención de insights para la creación y reelaboración de un producto digital a través de UX Research,True,4.5
Certificación PMP Parte 12: Otras áreas de trabajo,False,5.0
Certificación PMP Parte 13: Gestión de personas,False,4.67
Certificación PMP Parte 16: Consejos y tips para superar el test PMP,True,4.6
Certificación PMP Parte 17: Más consejos y tips para superar el test PMP,True,5.0
Certificación PMP Parte 15: Prerrequisitos e inscripción al PMP,True,4.75
Herramientas de Testing para Python,True,4.62
Certificación PMP Parte 14: Entorno de negocio,False,4.0
Migraciones con Django,True,5.0
Certificación PMP Parte 18: Entrenamiento para el test de PMP,True,5.0
Certificación PMP Parte 3: Cálculo de Rutas Críticas de proyecto,True,4.88
Certificación PMP Parte 4: Técnica del Valor ganado,True,4.77
Certificación PMP Parte 5: Introducción a Agile: Metodologías ágiles,False,4.62
Certificación PMP Parte 6: Visión del proyecto y generación del backlog,False,4.86
Certificación PMP Parte 7: Estimación y planificación ágil,False,4.67
Certificación PMP Parte 8: Kanban: Ejecución del proyecto,False,5.0
Certificación PMP Parte 9: Herramientas para escalado y liderazgo ágil,False,4.75
Certificación PMP Parte 10: Marco de gestión del proyecto,False,4.67
"Certificación PMP Parte 11: Gestión de tiempo, costes, alcance y recursos",False,0.0
Curso ITIL 4 Fundamentos Parte 1: Introducción y conceptos clave,False,4.83
Curso ITIL 4 Fundamentos Parte 2: Principios guía,False,4.75
Curso ITIL 4 Fundamentos Parte 3: Las 4 Dimensiones de la Gestión de Servicios,False,4.4
Curso ITIL 4 Fundamentos Parte 6: Introducción a las prácticas de ITIL,False,5.0
Taller ITIL 4 Fundamentos Parte 5: Flujo de valor,True,4.89
Curso ITIL 4 Fundamentos Parte 4: Sistema de Valor del Servicio,False,5.0
Curso ITIL 4 Fundamentos Parte 7: Ampliando Prácticas de ITIL,False,5.0
Certificación PMP Parte 1: Introducción al test de PMP,True,4.64
Certificación PMP Parte 2: Marco de procesos de gestión de proyectos,True,4.79
Debugging con PHP usando XDebug y Visual Studio Code,True,4.62
Crea una base de datos sin tocar SQL con TypeORM y Express,True,4.4
Escalares customizados y Enums en GraphQL,True,0.0
Crea una REST API escalable y sostenible con Typescript y Express,True,4.67
PostgreSQL en Azure,True,4.33
Gestión de bases de datos en la nube con Azure SQL,True,4.5
Observables con Subject en Angular,True,4.38
Curso de Power BI : Visualizaciones e informes,False,4.5
Curso de Casos prácticos: Certificación Excel Expert,False,4.0
Curso de certificación Excel Expert MO-201,False,5.0
Curso de Power BI Avanzado,False,4.16
Curso de Casos prácticos: Certificación PowerPoint Associate,False,4.67
Curso de Casos prácticos: Certificación Outlook Associate,False,5.0
Curso de certificación Outlook Associate MO-400,False,5.0
Curso de certificación PowerPoint Associate MO-300,False,4.0
Medición de eventos de Google Analytics con Google Tag Manager,True,4.67
"Mejora la seguridad de tu API con Typescript, Express y JWT",True,5.0
Desarrollo de WebServices SOAP con PHP,True,4.4
Curso de Patrones de diseño con JavaScript,False,3.62
Crea una aplicación con JavaScript utilizando Patrones de diseño,True,4.62
Curso de Patrones de diseño con JavaScript y asincronía,False,3.86
Curso de certificación Word Associate MO-100,False,0.0
Curso de Casos prácticos: Certificación Word Associate,False,4.5
Curso de certificación Word Expert MO-101,False,4.0
Curso de Casos prácticos: Certificación Word Expert MO-101,False,4.0
Curso de certificación Excel Associate MO-200,False,4.5
Curso de Casos prácticos: Certificación Excel Associate,False,4.0
AZ-500 Taller 6A: Implementar Azure Key Vault,True,4.0
AZ-500 Taller 6B: Segurizar el almacenamiento en Azure,True,0.0
Curso AZ-500 Parte 6: Datos y aplicaciones seguras,False,5.0
Curso AZ-500 Parte 7: Gestión de operaciones de seguridad,False,3.5
Laboratorio de Watson Discovery: Bots más inteligentes mediante búsquedas basadas en AI,False,4.2
AZ-500 Taller 7: Gestionar operaciones de seguridad en Azure,True,4.67
AZ-500 Taller 4B: Implementar Network Peering y NVA,True,0.0
Curso de Trucos de Excel,False,4.51
Laboratorio de Interpretación de imágenes mediante AI,False,4.0
Curso de Introducción a Google Analytics 4 (GA4),False,4.17
Curso de Trucos de Power BI,False,4.5
Introducción a la administración de BBDD con MySQL,True,4.35
Administración de BBDD con MySQL: Sentencias DDL y DML,True,4.67
Curso AZ-500 Parte 5: Seguridad del host y del contenedor,False,5.0
AZ-500 Taller 5B: Implementar Azure Disk Encription y Update Management,True,0.0
Administración de BBDD con MySQL: Procedimientos almacenados y relaciones,True,4.91
Creación de BBDD para eCommerce con MySQL,True,4.4
AZ-500 Taller 5A: Implementar ACR’s y AKS,True,5.0
AZ-500 Taller 1: Gestión de Azure Active Directory y Autenticación Multifactor,True,4.5
Curso AZ-500 Parte 2: Gobernanza empresarial y gestión de identidades híbridas,False,4.67
Curso AZ-500 Parte 1: Azure Active Directory,False,4.58
AZ-500 Taller 2: Sincronización de directorios con Azure,True,4.67
"AZ-500 Taller 3A: Azure RBAC, Azure Policy y Azure Locks",True,4.0
AZ-500 Taller 3B: Identidades privilegiadas e Identity Protection,True,5.0
"Curso AZ-500 Parte 3: Identity Protection, políticas y administración de identidades",False,4.5
AZ-500 Taller 4A: Implementar NSG’s y Azure Firewall,True,4.0
Curso AZ-500 Parte 4: Perímetro de seguridad y seguridad de la red,False,4.5
JavaScript con principios SOLID,True,4.7
Composer: Gestión de dependencias en PHP,True,4.33
Uso de IndexedDB como base de datos en el navegador,True,4.09
Curso de Principios de diseño SOLID,False,4.29
Curso de Desarrollo web con Jakarta Server Faces (JSF),False,4.59
Curso Crea un API Rest con Node JS y Express: Endpoint con Rest,False,4.55
Curso de Desarrollo web con Java EE/Jakarta EE,False,4.26
Curso de pruebas unitarias con Mockito,False,4.58
Curso Crea un API Rest con Node JS y Express: JWT y ficheros,False,4.42
Teletrabajo: Claves para una gestión eficaz,True,4.6
Curso de Encriptación punto a punto y securización de Nginx con Cloudflare,False,4.29
Curso de Testing en Java con JUnit 5,False,4.54
Gestión de tiempo: ¿Cómo hacer más y estresarnos menos?,True,4.42
Aprende a detectar tus estresores y manéjalos de forma positiva,True,4.53
Conecta Botium Box y Botium-CLI a tus bots y testéalos,True,4.5
Curso de Proyectos Java con Apache Maven,False,4.44
Curso de Web Components con LitElement,False,4.83
Curso de introducción al testing de bots con Botium,False,4.14
Vital Circus Feedback: Una nueva forma de retroalimentación,True,4.55
RASCI: La poderosa herramienta de comunicación para procesos y proyectos,True,4.55
Equipos operativos de alto desempeño,True,4.53
People Journey: Creación de experiencias hacia las personas dentro de la organización,True,4.23
"Curso de Desarrollo web con ASP.NET, SQL Server Y WCF",False,4.3
Curso Crea tu servidor web con Nginx sobre Linux (Debian),False,4.19
Consumo de WebServices SOAP con PHP,True,4.29
Curso de Introducción al diseño centrado en el usuario (UX),False,4.5
Migrar datos Microsoft Access/Excel a SQL Server con Integrations Services,True,4.77
Control de acceso con GraphQL,True,5.0
Teletrabajo y conciliación,True,4.48
Curso de Arquitectura Hexagonal (Ed. 2021),False,4.11
Curso GraphQL e implementación de APIs con Apollo,False,4.25
Comunicación en el equipo de trabajo,True,4.46
Crea una lista de tareas con Vue.JS,True,4.91
Desarrollo del potencial y autoestima del equipo de trabajo,True,4.48
Creencias limitantes y potenciadoras,True,4.0
Curso Manejo del estado con Redux y Angular en un eCommerce,False,4.22
Dashboards con Google Analytics,True,4.56
Curso de Asana: Configuración y funcionalidades,False,4.26
Curso de Estructuras liberadoras,False,3.5
Curso de Google Analytics para Empresas,False,4.31
Curso de mapas mentales y GTD para una productividad inteligente,False,4.02
Curso de Asana: Planificación y seguimiento de proyectos,False,4.5
Curso de Asana: Maneja la estrategia de negocio y gestión de equipos desde un mismo lugar,False,4.12
Estilos de planificación: descubre la más adecuada para ti,True,3.82
Crea e interpreta cronogramas con Instagantt,True,4.5
Curso Experto en EMQx,False,5.0
Curso Protocolo MQTT con Mosquitto,False,4.32
Curso de Monitorización con Grafana y Prometheus,False,4.38
Curso SAP: Introducción al módulo MM,False,4.36
Curso SAP: Introducción al módulo QM,False,4.22
Curso SAP: Introducción al módulo PP,False,4.26
Curso de Manipulación del DOM desde JavaScript,False,4.59
Curso de Optimización CSS,False,4.49
Curso de React avanzado,False,4.1
Curso de Figma,False,4.21
Curso de Gatsby,False,4.0
Curso de Gestión de Proyectos IT,False,4.44
Crear y presentar un Project Plan,True,4.37
Monta tu propio Virtual Lab con Hyper-V,True,4.72
Monta tu propio Virtual Lab con VMware Workstation,True,4.61
Monta tu propio Virtual Lab con VirtualBox,True,4.69
Curso de introducción a la Virtualización,False,4.75
AZ-104 Taller 8: Gestionar máquinas virtuales,True,4.8
Curso de Despliegues con Ansible,False,4.36
"AZ-104 Taller 9: Implementación de aplicaciones web, contenedores y Kubernetes",True,4.44
AZ-104 Taller 10: Aplicar la protección de datos,True,4.4
Curso AZ-104 Parte 8: Gestión de máquinas virtuales en Azure,False,3.33
AZ-104 Taller 11: Aplicar la monitorización en Azure,True,4.56
Curso AZ-104 Parte 9: Computación sin servidor,False,5.0
Curso AZ-104 Parte 10: Protección de datos en Azure,False,4.25
Curso de Amazon Web Services para SysAdmin,False,3.89
AZ-104 Taller 4: Implementación de redes virtuales,True,4.91
Curso AZ-104 Parte 11: Monitorización en Azure,False,4.27
Curso AZ-104 Parte 3: Administración de Azure,False,5.0
AZ-104 Taller 5: Implementar la conectividad entre sitios,True,4.8
Curso AZ-104 Parte 4: Redes virtuales,False,4.75
Curso AZ-104 Parte 5: Conectividad entre sitios,False,5.0
AZ-104 Taller 6: Gestionando el tráfico de red,True,5.0
AZ-104 Taller 7: Gestionar el almacenamiento de Azure,True,4.71
Curso AZ-104 Parte 7: Almacenamiento en Azure,False,4.83
Curso de Agile UML,False,4.05
Curso AZ-104 Parte 6: Gestión del tráfico de red,False,5.0
Curso de SEO on page,False,4.47
Curso de Arquitectura Web para SEO,False,4.41
AZ-104 Taller 1: Gestión de las identidades de Azure Active Directory,True,4.64
Curso AZ-104 Parte 1: Gestión de la identidad en Azure,False,4.31
Curso AZ-104 Parte 2: Gobernanza y cumplimiento en Azure,False,5.0
AZ-104 Taller 2B: Gestión de la gobernanza con Azure Policy,True,4.71
AZ-104 Taller 3: Gestión de los recursos de Azure,True,4.62
AZ-104 Taller 2A: Gestión de suscripciones y RBAC,True,4.71
Curso de Vue práctico en la vida real,False,3.93
Uso de eventos en Vue,True,4.31
Wireframing con Figma,True,4.35
Curso de JavaScript avanzado,False,4.17
Curso de OneDrive,False,4.34
Curso de React intermedio,False,4.2
Curso de fundamentos de SEO,False,4.53
Curso de OneNote,False,4.23
Curso de Outlook,False,4.47
Creación de extensiones en Twig,True,5.0
"Curso AZ-900 Parte 1: Servicios, soluciones y herramientas en Azure",False,4.47
User journey mapping en remoto con Miro,True,4.12
Curso de DAX en Power BI,False,4.19
"Curso AZ-900 Parte 2: Seguridad, Identidad y gestión de costes en Azure",False,4.25
Curso de fundamentos de PL/SQL,False,4.29
Programación asíncrona con Async y Await,True,4.68
Inspección de usabilidad en producto,True,4.18
Curso de PowerPoint,False,4.36
Curso de Excel: Macros,False,4.53
Curso de Excel: Herramientas de cálculo avanzado,False,4.62
"Curso de Power Query, Pivot y Map en Excel",False,4.47
Interpretación de voz humana mediante IA para chatbots,True,4.73
Laboratorio de Asistentes de voz para dispositivos IoT,False,4.5
Laboratorio de Node-RED: Programa sin escribir código,False,4.55
Curso de Excel: VBA avanzado,False,4.35
Curso de Microsoft Teams,False,4.27
Curso de Excel: VBA,False,4.51
Test-driven development en Laravel,True,4.22
Fundamentos de Test-driven development,True,4.52
Test-driven development en PHP con PHPUnit,True,4.21
Creación de pipelines en Gitlab para CI/CD,True,4.27
Curso de modelado de datos en Power BI,False,4.27
Curso de Excel: Funciones avanzadas,False,4.48
Curso de Excel: Gráficos,False,4.48
Curso de pruebas automatizadas en una Web con Docker,False,4.19
"Crea infraestructuras automatizadas para pruebas con Docker, Jenkins y Selenium Grid",True,4.57
Curso de Excel: Bases de datos,False,4.62
Crea tu primera PWA a partir de un proyecto en Angular,True,4.19
Curso de Excel para principiantes,False,4.55
Curso de Excel: Funciones básicas,False,4.53
Nativescript: Usando componentes como la cámara y el GPS,True,4.56
Curso de Word para principiantes,False,4.55
Visión general sobre Cloud Computing y Amazon Web Services,True,4.36
Curso de Amazon Web Services para desarrolladores,False,4.01
Curso de Word avanzado,False,4.29
Análisis forense avanzado en sistemas Windows,True,4.34
Curso de desarrollo de aplicaciones móviles con NativeScript y Angular,False,4.2
¿Cómo puede un equipo de calidad liderar un cambio en la metodología de trabajo?,True,4.41
Introducción a la Auditoría de Sistemas de control industrial,True,4.54
Curso de Selenium con Java intermedio,False,4.39
Ajax con Fetch,True,4.74
Cómo auditar un Sistema de control industrial,True,4.5
Ajax con XMLHttpRequest,True,4.47
"Microservicios con Spring Boot, Eureka y Angular",True,4.48
Desarrollo de CRUD con Java EE,True,4.61
Curso de Selenium con Python para principiantes,False,4.58
Oracle Performance: Herramientas principales de análisis,True,4.36
Curso de Java QA,False,3.8
Ajax con Axios,True,4.7
Análisis forense avanzado en sistemas Linux,True,4.53
Curso de JMeter para la implementación de pruebas de rendimiento,False,4.35
Curso de Selenium con Python intermedio,False,4.33
Oracle Performance: Estadísticas e Índices,True,4.29
Metodología OKR para conseguir resultados,True,4.16
Lab. IOT y desarrollo en Cloud de un dispositivo de sensorización,False,4.38
Análisis forense básico en sistemas Linux,True,4.32
Creando una aplicación con FastAPI,True,4.13
Curso de Creación de Bots de Telegram con Spring Boot,False,4.19
Oracle Performance: Introducción al análisis de rendimiento,True,4.34
Curso de FinTech: Revolucionando las finanzas,False,3.68
Análisis forense básico en sistemas Windows,True,4.25
Tareas asíncronas en Django con Celery,True,4.55
Curso Profundizando en Django y Django REST,False,4.34
Instala y configura firewalls con pfSense,True,3.92
Planifica iteraciones en proyectos de forma ágil,True,4.48
Instala y configura firewalls con Endian,True,4.05
Mejores prácticas en Django,True,4.27
Curso de Power BI: Preparación de los datos,False,4.16
Estimación ágil con Planning Poker,True,4.54
Curso de Hyperledger Fabric,False,3.29
Knative: Uso de serverless en Kubernetes,True,4.57
Curso de Conceptos clave del mundo IT,False,4.51
Snort para industria 4.0,True,4.19
Curso de Product Owner en la práctica,False,4.38
Curso de PHP: Ampliando conceptos,False,4.41
Convierte tu videojuego Phaser en app para Android,True,4.52
SCRUM: Gestionando equipos de trabajo,True,4.65
Metasploit para pentesting,True,4.46
Criptografía Simétrica y Asimétrica en la práctica,True,4.56
Curso de Power BI: Introducción,False,4.27
Probando APIs con Postman,True,4.21
Gestión de usuarios y permisos en Oracle,True,4.12
Gestión de espacio en Oracle: Tablespaces y Datafiles,True,4.42
Herramientas avanzadas para búsquedas OSINT,True,4.35
Curso de desarrollo de videojuegos básicos con Phaser,False,4.55
Curso de Design Thinking,False,4.55
Curso de PHP para principiantes,False,4.56
Diseña y utiliza un tablero Kanban,True,4.66
Curso de desarrollo avanzado de videojuegos con Phaser,False,4.83
Gestión de espacio en Oracle: Instancia ASM,True,4.5
Autopsy: Recuperación de datos,True,4.44
Curso de Angular: Ampliando conceptos,False,4.28
Curso de Hacking Tools & Forensic: Red Team,False,4.24
OSINT para fuga de datos empresariales,True,4.42
Kubernetes: Modelo de persistencia y pods,True,4.79
Curso de Automatización de pruebas de una UI en Angular con Protractor,False,4.29
Diseño web con Material Design para Angular,True,4.33
Curso de Testing de APIs con JMeter,False,4.4
Testing en Python,True,4.27
Curso de Angular para principiantes,False,4.19
Publicación de paquetes en Pypi,True,5.0
Curso de Chrome Developers Tools: Herramientas para el desarrollo,False,4.48
Code splitting en SPA con React,True,4.91
Curso de Hacking Tools: Blue Team,False,4.19
Istio para principiantes,True,4.81
Curso de Chrome Developers Tools: Analizando distintos aspectos de una web,False,4.44
Renderización de aplicaciones React en el servidor,True,4.71
Curso de Big Data,False,4.39
Crea login y signup con Kotlin y Firebase,True,4.6
Curso de manejo de estado con Clases y Hooks en React,False,4.53
Kubernetes para principiantes,True,4.34
Curso Crea una API REST con Django desde cero,False,4.43
Curso de Introducción al diseño de interfaz de Usuarios (UI),False,4.33
Kubernetes: Creación de contenedores y despliegue de aplicaciones,True,4.34
Curso de manejo de estado y data fetching en React,False,4.67
Crea aplicaciones desde cero con Figma,True,4.5
Curso de ECMAScript 6,False,4.41
Curso de visualización de datos con Seaborn,False,4.51
Lectura y escritura de diferentes fuentes con Pandas,True,4.33
Curso Crea una app interactiva en Kotlin,False,4.32
Crea Dark Mode usando CSS3 variables,True,4.36
Curso de manipulación de DataFrames con Pandas,False,4.5
Organízate con Angular,True,4.35
Publica tu aplicación en Play Store,True,4.54
Curso de visualización de datos con Matplotlib,False,4.31
Arquitectura CSS aplicando BEM Style con SCSS,True,4.37
Uso de Git en Android Studio,True,4.6
Curso de Kotlin,False,4.39
"Curso de anotaciones Lombok para Constructores, Equals y Hash code",False,4.36
Caso de estudio con Pandas,True,4.66
Curso Crea tu primera aplicación en Android,False,4.48
Curso Construye objetos variables y constantes con Lombok,False,4.38
Curso de TypeScript,False,4.44
Laboratorio Consumo de APIs con Retrofit y Kotlin,False,4.76
Clean Commits en proyectos NPM,True,4.56
Curso de Visualización de datos con Python,False,4.35
Curso Diseña y prototipa una app con Adobe XD,False,4.47
Curso de Symfony 5 avanzado,False,4.38
Curso de Introducción a Lombok: Primeras anotaciones,False,4.2
EDA: Exploratory Data Analysis con Python,True,4.24
Ejecución de aplicaciones en un emulador de Android,True,4.56
Curso de tratamiento de datos con Pandas y NumPy,False,4.52
Curso de anotaciones Lombok orientadas a objetos,False,4.29
Curso de Elasticsearch y Kibana para desarrolladores,False,4.18
Curso de C++: Introducción,False,4.63
Curso de análisis y gestión del riesgo,False,3.95
Curso de NumPy con Python,False,4.5
Curso de C++: Estructuras de control y tipos de datos,False,4.36
Curso de Symfony 5: Primeros pasos,False,4.38
Curso de C++: Programación estructurada y Orientación a Objetos,False,4.55
Curso de Symfony 5 intermedio,False,4.48
Novedades de Java 10 y 11,True,4.69
Curso de tratamiento de datos con Pandas en Python,False,4.59
